<?xml version="1.0" encoding="UTF-8"?>
<?xml-stylesheet type="text/xsl" href="../xslt/cabinet.xslt"?>
<cabinet xmlns="http://www.univ-grenoble-alpes.fr/l3miage/medical" xmlns:xsi="http://www.w3.org/2001/XMLSchema-instance" xsi:schemaLocation="http://www.univ-grenoble-alpes.fr/l3miage/medical ../xsd/cabinet.xsd">
  <!--Racine du document cabinet.xml-->
  <nom>Soins à Grenoble</nom>
  <adresse>
    <numéro>60</numéro>
    <rue>rue de la Chimie</rue>
    <codePostal>38041</codePostal>
    <ville>Grenoble</ville>
  </adresse>
  <!--Liste des infirmiers-->
  <infirmiers>
    <infirmier id="001">
      <nom>Fréchie</nom>
      <prénom>Sarah</prénom>
      <photo>sarah.png</photo>
    </infirmier>
    <infirmier id="002">
      <nom>Stické</nom>
      <prénom>Sophie</prénom>
      <photo>sophie.png</photo>
    </infirmier>
    <infirmier id="003">
      <nom>Ochon</nom>
      <prénom>Paul</prénom>
      <photo>paul.png</photo>
    </infirmier>
  </infirmiers>
  <!--Liste des patients-->
  <patients>
    <patient>
      <nom>Alécole</nom>
      <prénom>Yvon</prénom>
      <sexe>M</sexe>
      <naissance>1998-08-02</naissance>
      <numéroSS>198082205545852</numéroSS>
      <adresse>
        <étage>6</étage>
        <numéro>50</numéro>
        <rue>avenue Félix Viallet</rue>
        <codePostal>38031</codePostal>
        <ville>Grenoble</ville>
      </adresse>
      <visite date="2015-12-08" intervenant="001">
        <acte id="109" />
      </visite>
    </patient>
    <!-- Elvire Orouge est née le 08 mars 82 en France, à Lyon (n° 23 dans le rhône), il s’agissait de la 52e
         naissance dans cette ville. -->
    <patient>
      <nom>Orouge</nom>
      <prénom>Elvire</prénom>
      <sexe>F</sexe>
      <naissance>1982-03-08</naissance>
      <numéroSS>282036902305218</numéroSS>
      <adresse>
        <rue>Rond-Point de la Croix de Vie</rue>
        <codePostal>38700</codePostal>
        <ville>La Tronche</ville>
      </adresse>
      <visite date="2015-12-08">
        <acte id="300" />
      </visite>
    </patient>
    <!-- Oscare Pien est née le 25 mars 75 en France, à Chambéry (n° 65 dans la Savoie). 
         Il s’agissait de la 692e naissance. -->
    <patient>
      <nom>Pien</nom>
      <prénom>Oscare</prénom>
      <sexe>F</sexe>
      <naissance>1975-03-25</naissance>
      <numéroSS>275037306569202</numéroSS>
      <adresse>
        <rue>rue Casimir Brenier</rue>
        <codePostal>38000</codePostal>
        <ville>Grenoble</ville>
      </adresse>
      <visite date="2015-12-08" intervenant="001">
        <acte id="101" />
        <acte id="104" />
      </visite>
    </patient>
    <!--Xavier Kapoëtla est un petit garçon de 4 ans né le 02 août 2011 en France, à Bordeaux (n° 63 dans la Gironde).
        Il s'agit de la 35e naissance-->
    <patient>
      <nom>Kapoëtla</nom>
      <prénom>Xavier</prénom>
      <sexe>M</sexe>
      <naissance>2011-08-02</naissance>
      <numéroSS>111083306303521</numéroSS>
      <adresse>
        <numéro>25</numéro>
        <rue>rue des Martyrs</rue>
        <codePostal>38042</codePostal>
        <ville>Grenoble</ville>
      </adresse>
      <visite date="2015-12-08">
        <acte id="111" />
      </visite>
    </patient>
</patients>
</cabinet>